{
  "activeCaseIds": [
    "agent-approval-boundary-bypass-001",
    "agent-tool-timeout-retry-001",
    "api-oauth-scope-mismatch-001",
    "api-webhook-idempotency-001",
    "container-readiness-port-001",
    "customer-pilot-production-gap-001",
    "customer-success-criteria-001",
    "dns-private-endpoint-001",
    "etl-schema-drift-null-field-001",
    "fde-pilot-scope-control-001",
    "git-hotfix-wrong-branch-001",
    "inference-gpu-oom-capacity-001",
    "inference-quantization-regression-001",
    "k8s-secret-rotation-rollout-001",
    "llm-eval-dataset-leakage-001",
    "llm-prompt-context-order-001",
    "multi-region-rag-consistency-001",
    "observability-correlation-id-001",
    "python-config-precedence-001",
    "rag-permission-filter-gap-001",
    "rag-stale-policy-cache-001",
    "security-log-pii-exposure-001",
    "warehouse-late-arrival-watermark-001",
    "zero-downtime-schema-migration-001"
  ],
  "activeCases": [
    {
      "caseId": "agent-approval-boundary-bypass-001",
      "version": 1
    },
    {
      "caseId": "agent-tool-timeout-retry-001",
      "version": 1
    },
    {
      "caseId": "api-oauth-scope-mismatch-001",
      "version": 1
    },
    {
      "caseId": "api-webhook-idempotency-001",
      "version": 2
    },
    {
      "caseId": "container-readiness-port-001",
      "version": 1
    },
    {
      "caseId": "customer-pilot-production-gap-001",
      "version": 2
    },
    {
      "caseId": "customer-success-criteria-001",
      "version": 1
    },
    {
      "caseId": "dns-private-endpoint-001",
      "version": 1
    },
    {
      "caseId": "etl-schema-drift-null-field-001",
      "version": 1
    },
    {
      "caseId": "fde-pilot-scope-control-001",
      "version": 1
    },
    {
      "caseId": "git-hotfix-wrong-branch-001",
      "version": 1
    },
    {
      "caseId": "inference-gpu-oom-capacity-001",
      "version": 1
    },
    {
      "caseId": "inference-quantization-regression-001",
      "version": 1
    },
    {
      "caseId": "k8s-secret-rotation-rollout-001",
      "version": 1
    },
    {
      "caseId": "llm-eval-dataset-leakage-001",
      "version": 1
    },
    {
      "caseId": "llm-prompt-context-order-001",
      "version": 1
    },
    {
      "caseId": "multi-region-rag-consistency-001",
      "version": 2
    },
    {
      "caseId": "observability-correlation-id-001",
      "version": 1
    },
    {
      "caseId": "python-config-precedence-001",
      "version": 1
    },
    {
      "caseId": "rag-permission-filter-gap-001",
      "version": 1
    },
    {
      "caseId": "rag-stale-policy-cache-001",
      "version": 1
    },
    {
      "caseId": "security-log-pii-exposure-001",
      "version": 1
    },
    {
      "caseId": "warehouse-late-arrival-watermark-001",
      "version": 1
    },
    {
      "caseId": "zero-downtime-schema-migration-001",
      "version": 1
    }
  ],
  "activePublishedCaseCount": 24,
  "allCaseIds": [
    "agent-approval-boundary-bypass-001",
    "agent-tool-timeout-retry-001",
    "api-oauth-scope-mismatch-001",
    "api-webhook-idempotency-001",
    "container-readiness-port-001",
    "customer-pilot-production-gap-001",
    "customer-success-criteria-001",
    "dns-private-endpoint-001",
    "etl-schema-drift-null-field-001",
    "fde-pilot-scope-control-001",
    "git-hotfix-wrong-branch-001",
    "inference-gpu-oom-capacity-001",
    "inference-quantization-regression-001",
    "k8s-secret-rotation-rollout-001",
    "llm-eval-dataset-leakage-001",
    "llm-prompt-context-order-001",
    "multi-region-rag-consistency-001",
    "observability-correlation-id-001",
    "python-config-precedence-001",
    "rag-permission-filter-gap-001",
    "rag-stale-policy-cache-001",
    "security-log-pii-exposure-001",
    "warehouse-late-arrival-watermark-001",
    "zero-downtime-schema-migration-001"
  ],
  "cases": [
    {
      "caseId": "agent-approval-boundary-bypass-001",
      "contentHash": "sha256:f9b976b549b333237f6c45ddd5e437717bd121b5ce2976334c40c82f8c35edc4",
      "path": "content/cases/advanced/agent-approval-boundary-bypass-001.v1.json",
      "schemaVersion": 1,
      "status": "published",
      "version": 1
    },
    {
      "caseId": "agent-tool-timeout-retry-001",
      "contentHash": "sha256:f21b96ae93a79adc0e5064cef0fba9a7d012580d4b0c07501042e85d89cf4407",
      "path": "content/cases/intermediate/agent-tool-timeout-retry-001.v1.json",
      "schemaVersion": 1,
      "status": "published",
      "version": 1
    },
    {
      "caseId": "api-oauth-scope-mismatch-001",
      "contentHash": "sha256:504a493a2136d457d06c1bbdd0dba57cafec00bab4019808903cf2230163450b",
      "path": "content/cases/beginner/api-oauth-scope-mismatch-001.v1.json",
      "schemaVersion": 1,
      "status": "published",
      "version": 1
    },
    {
      "caseId": "api-webhook-idempotency-001",
      "contentHash": "sha256:76eba25f2c7750e0ddfe831f6f012ee9de2bb09defb0f49f25c64f1be074ecf2",
      "path": "content/cases/intermediate/api-webhook-idempotency-001.v1.json",
      "schemaVersion": 1,
      "status": "published",
      "version": 1
    },
    {
      "caseId": "api-webhook-idempotency-001",
      "contentHash": "sha256:8165bafcf339a20f75fc6ea82378078c8d19d12a2de5524131af3979a7d88930",
      "path": "content/cases/intermediate/api-webhook-idempotency-001.v2.json",
      "schemaVersion": 1,
      "status": "published",
      "version": 2
    },
    {
      "caseId": "container-readiness-port-001",
      "contentHash": "sha256:ac94104afac3686338d588d740ffa24892eb1e4416764419d704eb809d13004c",
      "path": "content/cases/beginner/container-readiness-port-001.v1.json",
      "schemaVersion": 1,
      "status": "published",
      "version": 1
    },
    {
      "caseId": "customer-pilot-production-gap-001",
      "contentHash": "sha256:07428ee54b8c8dae5997b627739e3f21427be0e7ba218d31618d35a635bdf994",
      "path": "content/cases/intermediate/customer-pilot-production-gap-001.v1.json",
      "schemaVersion": 1,
      "status": "published",
      "version": 1
    },
    {
      "caseId": "customer-pilot-production-gap-001",
      "contentHash": "sha256:df8d9b7c360181c11bb100f7d0772c2fd96fdda08ddb26d6aeaeaf5737e3ecc8",
      "path": "content/cases/intermediate/customer-pilot-production-gap-001.v2.json",
      "schemaVersion": 1,
      "status": "published",
      "version": 2
    },
    {
      "caseId": "customer-success-criteria-001",
      "contentHash": "sha256:f98666382fa5909c0293ae40cab4560e9ce8ac9cbb361061cb1999dfe6f72d80",
      "path": "content/cases/beginner/customer-success-criteria-001.v1.json",
      "schemaVersion": 1,
      "status": "published",
      "version": 1
    },
    {
      "caseId": "dns-private-endpoint-001",
      "contentHash": "sha256:e4a8c656f56bccdfd70d3d4259b05f172743c0ee510138f4549609baef846166",
      "path": "content/cases/beginner/dns-private-endpoint-001.v1.json",
      "schemaVersion": 1,
      "status": "published",
      "version": 1
    },
    {
      "caseId": "etl-schema-drift-null-field-001",
      "contentHash": "sha256:b724d59b2008d3446dd311d93eb174dfeca1d652f093632989137611c97facd7",
      "path": "content/cases/beginner/etl-schema-drift-null-field-001.v1.json",
      "schemaVersion": 1,
      "status": "published",
      "version": 1
    },
    {
      "caseId": "fde-pilot-scope-control-001",
      "contentHash": "sha256:75ade06089fec6ec6ae076a6299913a0458ce199ce78131200199ad08250097a",
      "path": "content/cases/beginner/fde-pilot-scope-control-001.v1.json",
      "schemaVersion": 1,
      "status": "published",
      "version": 1
    },
    {
      "caseId": "git-hotfix-wrong-branch-001",
      "contentHash": "sha256:7729a505a48ed90ca8afcdd838fc5c83bc7aa00dcdd91f9d1766115f0a3e5231",
      "path": "content/cases/beginner/git-hotfix-wrong-branch-001.v1.json",
      "schemaVersion": 1,
      "status": "published",
      "version": 1
    },
    {
      "caseId": "inference-gpu-oom-capacity-001",
      "contentHash": "sha256:258811ad0366a6e51868b67aa2eab54189fdfd81364640066e5911fa833834e5",
      "path": "content/cases/advanced/inference-gpu-oom-capacity-001.v1.json",
      "schemaVersion": 1,
      "status": "published",
      "version": 1
    },
    {
      "caseId": "inference-quantization-regression-001",
      "contentHash": "sha256:b6ca124e9e51ef9f52aa091334caa8b0d20d41aa04ecefd699c5d080d94ee95d",
      "path": "content/cases/intermediate/inference-quantization-regression-001.v1.json",
      "schemaVersion": 1,
      "status": "published",
      "version": 1
    },
    {
      "caseId": "k8s-secret-rotation-rollout-001",
      "contentHash": "sha256:b6d1349886a56f1d4d326bc16ca96924bf1f4ee2a5f77aa26abe6b27f61234d5",
      "path": "content/cases/intermediate/k8s-secret-rotation-rollout-001.v1.json",
      "schemaVersion": 1,
      "status": "published",
      "version": 1
    },
    {
      "caseId": "llm-eval-dataset-leakage-001",
      "contentHash": "sha256:430ff60f1ec462436eb576ff7528de0639335a80aa322a9a40f7e06865a77cba",
      "path": "content/cases/intermediate/llm-eval-dataset-leakage-001.v1.json",
      "schemaVersion": 1,
      "status": "published",
      "version": 1
    },
    {
      "caseId": "llm-prompt-context-order-001",
      "contentHash": "sha256:e2b96e30f7606c3ba83355ea5e737f171108756950ce4df68617bce81022c7ca",
      "path": "content/cases/beginner/llm-prompt-context-order-001.v1.json",
      "schemaVersion": 1,
      "status": "published",
      "version": 1
    },
    {
      "caseId": "multi-region-rag-consistency-001",
      "contentHash": "sha256:5a15f7da3c761f62906b9a515f15924b56a081b0d1595eee6b0dd479b5c192d9",
      "path": "content/cases/advanced/multi-region-rag-consistency-001.v1.json",
      "schemaVersion": 1,
      "status": "published",
      "version": 1
    },
    {
      "caseId": "multi-region-rag-consistency-001",
      "contentHash": "sha256:b850ce817933b84e5269a9d4189c1730808828f0bd18a0d2c4e77fbdb32e1811",